{
  "registryId": "sirinx-47-ronin-passive-role-registry",
  "registryVersion": "1.0.0",
  "status": "passive-specification",
  "executable": false,
  "description": "A non-executable specification of 47 logical SIRINX roles plus the separate draft-only Kai liaison.",
  "authority": {
    "numericRoleRanges": "Rust numeric ranges in crates/sirinx-agents/src/roster.rs are authoritative.",
    "runtimeMeaning": "The 47 entries are logical roles, not processes.",
    "durableStateAuthority": "Postgres is the sole durable task, lease, approval, gate, and receipt authority.",
    "maxConcurrentWorkers": 3,
    "lanePolicy": [
      "one-maker",
      "one-independent-checker",
      "one-verifier-or-researcher"
    ],
    "makerCheckerSeparation": "A maker and checker must use different role IDs, principals, and leases for the same stage.",
    "externalActions": false,
    "externalActionPolicy": "No external action is enabled by this registry. Install, provider call, live send, push, merge, production migration, Cloudflare mutation, and deploy each require a separate exact task-specific human ticket."
  },
  "departments": [
    {
      "departmentId": "L1",
      "title": "Perception",
      "range": "01-16",
      "count": 16,
      "headRoleId": 1,
      "headCodename": "Kuranosuke",
      "defaultActionClasses": [
        "A"
      ]
    },
    {
      "departmentId": "L2",
      "title": "Analysis",
      "range": "17-25",
      "count": 9,
      "headRoleId": 17,
      "headCodename": "Jūnai",
      "defaultActionClasses": [
        "A"
      ]
    },
    {
      "departmentId": "L3",
      "title": "Decision",
      "range": "26-35",
      "count": 10,
      "headRoleId": 26,
      "headCodename": "Kihei",
      "defaultActionClasses": [
        "A",
        "B_PLAN_ONLY"
      ]
    },
    {
      "departmentId": "L4",
      "title": "Coordination",
      "range": "36-43",
      "count": 8,
      "headRoleId": 36,
      "headCodename": "Gengo",
      "defaultActionClasses": [
        "A",
        "B_COORDINATION"
      ]
    },
    {
      "departmentId": "L5",
      "title": "Research",
      "range": "44-47",
      "count": 4,
      "headRoleId": 44,
      "headCodename": "Mimura",
      "defaultActionClasses": [
        "A"
      ]
    }
  ],
  "runtimePrincipals": [
    {
      "runtimePrincipalId": "sirinx-rust-runtime",
      "roleIds": [
        1,
        2,
        3,
        4,
        17,
        18,
        19,
        26,
        36
      ],
      "sourceAccess": "compiled-runtime-only"
    },
    {
      "runtimePrincipalId": "webmcp",
      "roleIds": [
        5,
        6,
        7,
        45
      ],
      "sourceAccess": "read-only"
    },
    {
      "runtimePrincipalId": "claude-code",
      "roleIds": [
        8,
        9,
        10,
        20,
        21,
        30,
        31,
        42
      ],
      "sourceAccess": "read-only"
    },
    {
      "runtimePrincipalId": "claude-cowork",
      "roleIds": [
        11,
        12,
        32,
        46
      ],
      "sourceAccess": "read-only"
    },
    {
      "runtimePrincipalId": "hermes",
      "roleIds": [
        13,
        27,
        28,
        29,
        35
      ],
      "sourceAccess": "read-only"
    },
    {
      "runtimePrincipalId": "manus",
      "roleIds": [
        14,
        47
      ],
      "sourceAccess": "read-only"
    },
    {
      "runtimePrincipalId": "droid",
      "roleIds": [
        15
      ],
      "sourceAccess": "read-only"
    },
    {
      "runtimePrincipalId": "pi",
      "roleIds": [
        16
      ],
      "sourceAccess": "read-only"
    },
    {
      "runtimePrincipalId": "kimi-code",
      "roleIds": [
        22,
        23,
        44
      ],
      "sourceAccess": "read-only"
    },
    {
      "runtimePrincipalId": "codex",
      "roleIds": [
        24,
        33,
        34,
        37,
        38,
        39
      ],
      "sourceAccess": "write-with-exact-path-lease-for-l4-only"
    },
    {
      "runtimePrincipalId": "copilot-cli",
      "roleIds": [
        25
      ],
      "sourceAccess": "read-only"
    },
    {
      "runtimePrincipalId": "opencode",
      "roleIds": [
        40
      ],
      "sourceAccess": "read-only-except-exact-artifact-job"
    },
    {
      "runtimePrincipalId": "antigravity2",
      "roleIds": [
        41
      ],
      "sourceAccess": "candidate-output-only"
    },
    {
      "runtimePrincipalId": "openclaw",
      "roleIds": [
        43
      ],
      "sourceAccess": "no-repo-source-write"
    }
  ],
  "roles": [
    {
      "roleId": 1,
      "cardId": "ronin-01-kuranosuke-intake",
      "functionalRoleId": "intake.command-normalizer",
      "departmentId": "L1",
      "departmentTitle": "Perception",
      "codename": "Kuranosuke",
      "title": "Intake and Lead Normalization Head",
      "mission": "Normalize bounded intake into a validated L1 observation envelope compatible with the coded lead pipeline.",
      "headRoleId": 1,
      "reportsTo": "ronin-17-junai-lead-analyst",
      "runtimePrincipalId": "sirinx-rust-runtime",
      "runtimePrincipalBoundary": "compiled-runtime-only",
      "actionClasses": [
        "A"
      ],
      "responsibilities": [
        "Validate declared input shape without reading secrets.",
        "Remove irrelevant noise while preserving consent and provenance fields.",
        "Forward only an observation envelope to L2; never select or execute an action."
      ],
      "allowedInputs": [
        "approved-goal",
        "bounded-lead-or-command-payload",
        "declared-consent-and-source-metadata"
      ],
      "outputs": [
        "observation-envelope",
        "normalized-lead-envelope"
      ],
      "requiredEvidence": [
        "input-payload-digest",
        "shape-validation-result",
        "L1-to-L2-publish-receipt"
      ],
      "prohibitedActions": [
        "secret-read-or-disclosure",
        "self-approval-or-risk-downgrade",
        "unleased-source-or-runtime-mutation",
        "external-action-without-an-exact-unexpired-task-specific-ticket",
        "claiming-completion-without-independent-evidence",
        "tool-execution",
        "risk-classification",
        "approval-or-gate-decision"
      ],
      "escalation": [
        "ronin-17-junai-lead-analyst"
      ],
      "backgroundCadence": "Event-driven on each admitted intake.",
      "implementationStatus": "coded-rust-runtime-plus-passive-card",
      "sourceRefs": [
        "crates/sirinx-agents/src/roster.rs",
        "services/dev-control-api/src/runtime-agent-cards.mjs",
        "SYSTEM_ARCHITECTURE.md",
        "docs/agents/ronin/README.md",
        "crates/sirinx-agents/src/ronin.rs"
      ]
    },
    {
      "roleId": 2,
      "cardId": "ronin-02-fb-group-scanner",
      "functionalRoleId": "perception.fb-group-scanner",
      "departmentId": "L1",
      "departmentTitle": "Perception",
      "codename": "FbGroupScanner",
      "title": "Public Facebook Group Lead Scanner",
      "mission": "Transform an approved public Facebook-group observation into the coded lead-scanned envelope.",
      "headRoleId": 1,
      "reportsTo": "ronin-01-kuranosuke-intake",
      "runtimePrincipalId": "sirinx-rust-runtime",
      "runtimePrincipalBoundary": "compiled-runtime-only",
      "actionClasses": [
        "A"
      ],
      "responsibilities": [
        "Accept only approved public-post content supplied to the task.",
        "Apply the coded parser and conservative lead defaults.",
        "Emit a Kuranosuke-compatible envelope for L2 scoring."
      ],
      "allowedInputs": [
        "approved-public-post-snapshot",
        "source-provenance",
        "task-scope"
      ],
      "outputs": [
        "lead-scanned-envelope",
        "parser-observation"
      ],
      "requiredEvidence": [
        "source-snapshot-digest",
        "parser-result",
        "L1-to-L2-publish-receipt"
      ],
      "prohibitedActions": [
        "secret-read-or-disclosure",
        "self-approval-or-risk-downgrade",
        "unleased-source-or-runtime-mutation",
        "external-action-without-an-exact-unexpired-task-specific-ticket",
        "claiming-completion-without-independent-evidence",
        "account-login-or-session-use",
        "private-group-scraping",
        "automated-contact-or-message"
      ],
      "escalation": [
        "ronin-01-kuranosuke-intake"
      ],
      "backgroundCadence": "Event-driven only for explicitly supplied public snapshots.",
      "implementationStatus": "coded-rust-runtime-plus-passive-card",
      "sourceRefs": [
        "crates/sirinx-agents/src/roster.rs",
        "services/dev-control-api/src/runtime-agent-cards.mjs",
        "SYSTEM_ARCHITECTURE.md",
        "docs/agents/ronin/README.md",
        "crates/sirinx-agents/src/fb_group.rs"
      ]
    },
    {
      "roleId": 3,
      "cardId": "ronin-03-line-events-scanner",
      "functionalRoleId": "perception.line-events-scanner",
      "departmentId": "L1",
      "departmentTitle": "Perception",
      "codename": "LineEventsScanner",
      "title": "LINE Event Lead Scanner",
      "mission": "Normalize an approved LINE event fixture into the coded lead-scanned envelope without sending a message.",
      "headRoleId": 1,
      "reportsTo": "ronin-01-kuranosuke-intake",
      "runtimePrincipalId": "sirinx-rust-runtime",
      "runtimePrincipalBoundary": "compiled-runtime-only",
      "actionClasses": [
        "A"
      ],
      "responsibilities": [
        "Validate supported event shape.",
        "Extract bounded text and lead hints conservatively.",
        "Emit a Junai-compatible observation envelope."
      ],
      "allowedInputs": [
        "approved-line-event-fixture",
        "event-provenance",
        "task-scope"
      ],
      "outputs": [
        "lead-scanned-envelope",
        "unsupported-event-observation"
      ],
      "requiredEvidence": [
        "event-payload-digest",